"username","country_name","rating","text_review","arrival_date","departure_date"
"tylerdavidson","Cameroon",5.8,"Save everyone sense week customer candidate. Test appear top recognize support. Keep away seat art.","1993-04-13","1982-01-05"
"tylerdavidson","Grenada",5.2,"Other get represent leave reality true.","1999-07-18","1982-08-25"
"tylerdavidson","Slovenia",0.6,"Structure kitchen they summer toward. Call nearly during perform fire discover push. War great resource nation sort edge.","1986-07-15","2004-06-15"
"tylerdavidson","Turkmenistan",3.5,"Western parent thank behavior blue trade generation.","2003-01-03","2009-11-05"
"tylerdavidson","Haiti",1.2,"Care whom likely knowledge trouble position. Decide interest cause drug himself carry care reason. Have effect without win wife less.","2003-04-26","2014-05-10"
"tylerdavidson","Libya",2.0,"Since think candidate arm. Despite crime conference address hear.","1995-01-18","2018-12-13"
"tylerdavidson","Liechtenstein",8.1,"Small long since bring research. Moment page list same reduce personal future involve.","2008-02-28","1979-05-06"
"tylerdavidson","Kiribati",6.1,"There single she enough father recent.","1971-11-22","1994-10-19"
"tylerdavidson","East Timor",1.1,"Adult on anything series positive interest interesting about. Again service show bank challenge. So by support.","1976-12-30","1980-11-01"
"david31","Democratic Republic of the Congo",8.6,"Along tend program. Whatever trip past movement. Reduce degree this significant pay action teach.","1980-02-27","1970-01-28"
"david31","Niger",3.2,"Land while themselves we history. Impact fear present network. Commercial heavy and agree very traditional.","1998-06-09","1978-01-17"
"david31","Saint Lucia",2.4,"Stay girl education want top.","2009-01-05","2019-04-10"
"david31","Morocco",1.3,"Face vote whole go everything keep. Suggest mean character film soon instead once.","2006-10-21","1977-02-04"
"david31","Papua New Guinea",4.7,"Forget whole time him two. Opportunity central door whose network.","1985-02-27","1971-01-10"
"david31","Slovakia",8.1,"Person specific lawyer total. Include else take. Cup partner any run suddenly.","1970-02-27","1998-02-21"
"anthonypatterson","Guatemala",5.9,"Worker phone difference marriage across design everyone. Finish peace both light employee federal Republican.","1981-01-16","2002-08-24"
"anthonypatterson","Latvia",6.9,"Dog any someone loss sense. Red color behind office forward key.","1984-09-16","1992-07-29"
"anthonypatterson","Honduras",8.9,"Support population pattern future degree guess between. Scene determine poor affect water study. I maintain church finally along.","2020-07-14","1974-11-01"
"anthonypatterson","Mozambique",9.3,"Stage choose history citizen capital size. All happen result week table cell success building.","2012-10-25","1996-02-03"
"anthonypatterson","Madagascar",7.5,"Owner main role that.","2005-02-16","1991-08-31"
"anthonypatterson","Singapore",5.6,"Establish where know visit Republican discuss then. Office individual get movie goal. Single tonight because hair actually born.","2003-10-03","2002-07-31"
"anthonypatterson","S?o Tomé and Príncipe",7.9,"Left two all between certain research management choice. Bank officer mean production.","1981-07-09","1998-10-14"
"anthonypatterson","Jordan",3.9,"Lot movement play great light marriage. Dog but dog.","1974-01-11","1985-05-15"
"poncemark","Papua New Guinea",3.5,"Effect once approach trouble. School there far pressure establish together.","1985-11-14","1998-11-19"
"poncemark","Somalia",7.4,"Create serious far. Health owner laugh too court important would.","1982-09-12","1970-02-07"
"poncemark","Nicaragua",2.8,"Candidate lead him plan happy. Such let want before imagine.","2014-08-16","1992-06-10"
"poncemark","S?o Tomé and Príncipe",2.2,"Talk answer identify stuff size international. Drop week first say task new.","1970-07-18","2006-08-28"
"poncemark","Bulgaria",5.1,"Affect worker available agree occur really reflect. Need great interest bad speech day impact impact. Culture relate event long.","1993-04-06","2010-10-15"
"poncemark","Portugal",9.9,"Number whom face quickly. Miss provide service really. Name open all spend side responsibility.","2017-01-02","2019-01-03"
"poncemark","Niger",1.0,"Else report official front run director two. Writer another door bit. Pressure keep else high. Everything night to easy.","1971-09-18","2012-04-01"
"iroberts","Liechtenstein",4.5,"Always simply wide Mrs tough understand who. Head general husband collection.","2002-09-14","2002-11-29"
"iroberts","Guyana",6.8,"Stage explain he watch piece institution itself someone. Design early few go culture shake. Have treatment although seven how.","1971-06-06","2000-01-08"
"iroberts","Slovenia",6.2,"Ball dream woman decade window left school. Line hair fear green either reach pick. Staff would beautiful fund. Cold her process whom best among enjoy.","1998-07-28","1993-06-26"
"iroberts","Zambia",7.5,"Play along claim year ahead work similar. Keep thought bill later. Throughout environmental its onto.","1992-03-20","2007-04-21"
"iroberts","Romania",7.4,"As likely guy method become. Bit majority base crime machine vote go. Sense century true opportunity.","1972-01-18","2020-02-09"
"iroberts","Poland",6.1,"Why cultural especially. A more above. With toward ability.","1977-09-11","1995-08-03"
"scottrodriguez","Norway",9.5,"Word not pass piece. Do expect else business try heart. Class collection energy adult allow become.","1989-05-30","1970-07-09"
"scottrodriguez","Cameroon",8.8,"Store find list political require. Close sign talk type seven reality final.","1983-09-19","2014-02-15"
"scottrodriguez","Cyprus",3.2,"Foreign arm its catch listen prevent rather management. Third training room total. Court interest approach visit do red.","1992-12-28","1971-04-19"
"scottrodriguez","Fiji",4.9,"Her sort simply stock out born reveal. Manager control suddenly house like way over one. Technology place believe town.","1995-09-20","2009-01-09"
"scottrodriguez","Spain",6.9,"Close strong international test behind. Future phone local. Style news space foreign sit view.","1984-06-10","2013-10-03"
"parksbrett","Sri Lanka",6.6,"Market special serve positive play water. Oil family store. Money final involve individual plant happy term.","1984-03-26","1973-10-09"
"parksbrett","Mauritius",6.9,"Difficult worry ball control would record occur common. American remember science per.","2010-05-18","1999-01-18"
"parksbrett","Angola",4.1,"None into behind toward performance song indicate nearly. Policy cause purpose hair walk or already.","2005-11-11","1987-11-30"
"parksbrett","Fiji",0.1,"Usually entire east street sea. Condition lot analysis smile window. Industry watch new.","1990-08-03","1980-12-22"
"parksbrett","Netherlands",6.4,"Behind among successful student environmental seat kitchen discuss. Police everybody relationship at which.","1970-12-19","1971-05-02"
"changchristopher","Mozambique",1.4,"Seek production economic benefit. Question what popular question.","1981-03-29","2013-03-04"
"changchristopher","North Korea",7.6,"Budget sense machine program age machine especially. One media peace very citizen. Full edge may along claim executive change.","2008-05-30","2021-09-11"
"changchristopher","Bosnia and Herzegovina",7.7,"Although meeting hot move mother remain. Bar writer sense call particularly either.","2010-10-02","1997-06-20"
"changchristopher","Vatican City",6.2,"Many table action. Woman executive unit your plant including. Old involve prevent alone.","1988-07-01","1993-11-26"
"changchristopher","Lithuania",1.7,"Break father something southern employee. Will campaign different never step.","1989-12-01","2014-02-26"
"changchristopher","South Africa",7.8,"Always nearly put explain daughter newspaper local. Sense produce work listen thing feeling season.","1998-10-26","1989-11-19"
"changchristopher","Tanzania",3.4,"Above energy attack.","2019-12-06","1993-05-29"
"renee19","Bhutan",0.6,"Today agent moment anyone friend. Sign door knowledge page remain. Magazine ask along phone our book suddenly.","1977-07-15","1994-11-11"
"renee19","Austria",4.0,"Sea administration fund follow behind step allow. Theory several senior some pay think though.","1998-02-07","2014-11-04"
"renee19","Spain",9.2,"Easy how wife discussion money. Response walk late research hour attorney of through. Our spring truth face state.","2001-07-01","2003-09-21"
"renee19","Papua New Guinea",5.3,"Determine degree into free tonight provide loss. Treat today manage win become always. North receive card public research computer. Owner consumer step fast shake step.","1996-04-10","2020-04-15"
"renee19","United States",2.2,"Ball strong green focus star yet south.","1985-08-12","2019-04-03"
"howardkelsey","Italy",1.8,"Within success capital run hold response strong.","1978-11-04","2007-01-14"
"howardkelsey","Madagascar",7.4,"Improve his pay whole forward send. Turn political color evidence choice.","1983-07-05","1994-10-28"
"howardkelsey","Eritrea",5.7,"Hundred visit two safe course. Clearly result source. Mrs number piece light since soon lot.","1986-02-27","1984-04-05"
"howardkelsey","East Timor",5.3,"Arrive himself wonder them. Study product attack somebody.","2002-05-11","2011-03-14"
"howardkelsey","Slovakia",3.6,"However base door ok present gun. Join like window style western direction policy name. Section first most meeting.","1983-03-17","2007-08-26"
"howardkelsey","Romania",2.3,"Help hard or reality return beautiful. Whose house bill. Collection never arrive individual home coach audience today.","1970-01-03","2007-02-12"
"howardkelsey","Republic of Ireland",8.0,"Throughout nature knowledge agreement entire. Start clearly recently pay performance. Voice speak seat their sport.","2011-09-05","2013-06-07"
"howardkelsey","Antigua and Barbuda",5.8,"Fast boy though two.","2012-07-01","1979-12-16"
"steven93","South Africa",9.4,"Enjoy high service local media. Form lay camera collection chance know us usually.","2001-03-09","2001-07-08"
"steven93","Bahrain",4.0,"Own get all picture travel federal. Indeed prepare institution later. Minute institution newspaper all court.","1987-10-18","1983-07-08"
"steven93","Liechtenstein",2.3,"Ok check bit happen hear yourself allow. Foot hotel message successful spend conference share spend.","1984-02-08","1999-05-23"
"steven93","Rwanda",4.4,"Kid someone agent investment. Recent least seem be notice especially left. Teach line agent each size.","1970-09-26","1987-06-29"
"steven93","Lebanon",3.2,"Time walk brother light property. System Democrat machine stage customer fish. Pull partner night girl condition require.","2018-06-29","2014-12-17"
"steven93","Ethiopia",3.6,"Face protect certain city standard. Contain feeling stage grow use between. Three black drive deal treatment together remember.","1986-12-05","2001-07-02"
"steven93","Lebanon",0.0,"Themselves thus to character program. A win as or party. Worker specific laugh hour so American choice.","1983-04-15","1991-11-29"
"steven93","Argentina",7.0,"Interesting choose indeed true other walk short employee. Party nice bed general cost.","1992-06-28","2014-04-08"
"nicoleedwards","France",5.2,"Energy officer blue thousand though star happy at. Draw former military enjoy door.","2010-08-04","1977-05-13"
"nicoleedwards","Dominican Republic",1.3,"Over already she everybody tonight road sister. Enjoy spend believe plant bag law education.","2001-03-16","1991-01-06"
"nicoleedwards","Armenia",5.9,"Right your leg song away he agree man. Talk full situation this ago east military.","2008-02-16","2001-07-08"
"nicoleedwards","Guatemala",6.5,"Effort themselves yeah want. Oil finish agree suffer others city. Stage shake lay clear face skin.","2000-10-22","1990-02-09"
"nicoleedwards","Andorra",1.4,"Space father throw somebody decision. Could show central exactly likely purpose clear across. Game sign situation require sure.","2017-09-06","2006-12-21"
"nicoleedwards","Sweden",8.9,"Strategy big safe dinner rock baby third country. Explain practice network reach our fall.","1972-03-26","1982-10-04"
"nicoleedwards","Cape Verde",0.4,"Stuff trouble painting often itself whole reality. News hundred we everybody. Record continue experience coach cell not enjoy.","1997-03-07","2009-02-12"
"hornesarah","Iran",5.1,"City painting final it occur around half sea.","2013-02-12","1992-03-08"
"hornesarah","Saint Lucia",5.5,"Push citizen wait. Situation toward become over table. Center box notice thought relationship fund.","1985-10-22","1981-05-19"
"hornesarah","Malaysia",9.5,"Election TV Mr government material education pretty.","1987-04-04","1981-11-29"
"hornesarah","Moldova",9.0,"Order provide catch sister structure western. Very letter sell senior enjoy.","1972-08-15","1997-01-17"
"hornesarah","Republic of Ireland",8.4,"Suggest phone technology information like no. House benefit follow central. East from especially little bring month top against.","1980-06-03","2007-02-08"
"hornesarah","Saudi Arabia",7.3,"Especially time hold process listen remember recognize. Tree call physical fight war. Unit thousand however first.","1996-09-04","2020-08-21"
"hornesarah","Italy",2.6,"Rise media treat animal nature billion forget. Easy campaign look leave street miss force meet. Hold stock lawyer study chair work.","1977-03-04","2002-11-26"
"denise71","Montenegro",3.0,"Piece prepare car mean reach. Sing serious population section party election. Find treatment standard.","2005-04-24","1974-12-23"
"denise71","Mozambique",3.5,"Black court medical behind place. Economy group exactly good.","2013-12-15","1982-01-02"
"denise71","Greece",2.5,"Social care drop quite theory. Off Democrat however general. Compare question successful us individual amount.","2006-07-16","2011-08-02"
"denise71","Argentina",4.5,"Sell hundred here hospital feeling poor push. Sort there push listen available. Not even event heavy tough specific or.","1982-01-25","1999-04-15"
"denise71","Czech Republic",6.0,"Art tree nor likely employee. Stock figure PM table.","1994-10-13","1982-01-22"
"courtney70","Botswana",2.9,"Their rule trial west all. Bed finally world management. Build task may measure.","2007-07-10","2004-07-11"
"courtney70","Canada",9.6,"So PM forget room build blood most. Happy report radio sing.","1986-05-01","2008-12-26"
"courtney70","Romania",6.2,"Right base soldier. Wife country develop while respond energy foot. Something debate raise beautiful light. Education create lawyer always on manager owner.","1995-07-06","1993-03-10"
"courtney70","Saint Kitts and Nevis",7.8,"Effect interest three child. Suffer camera professor letter worry.","1983-12-18","2011-10-13"
"courtney70","Saudi Arabia",3.6,"Rock Mr cause strong seven some condition.","1990-11-15","2015-01-30"
"courtney70","Burkina Faso",6.4,"Century firm daughter take. Suddenly mean late remember go dinner.","2019-01-01","1986-01-16"
"courtney70","Iran",2.4,"Yard wrong customer race draw. Various public machine answer.","1991-03-10","2016-07-14"
"courtney70","Greece",0.2,"Begin theory participant drive put. Production believe not arrive often.","1985-12-12","1976-05-07"
"jacobcooper","Antigua and Barbuda",6.2,"War its career. Evening kitchen account agreement Mrs.","2008-03-02","1996-07-12"
"jacobcooper","Nigeria",6.1,"Anyone professor serve story. Value possible service add guess manage. Career hundred laugh three between world. Amount capital able feel form ahead.","2021-02-07","2003-01-09"
"jacobcooper","Mexico",4.8,"Still deep kid really never lead life type.","1990-11-06","2013-07-11"
"jacobcooper","East Timor",6.0,"Early value drug common. Here accept above become above myself. Significant herself to necessary though see.","1970-05-11","1981-09-15"
"jacobcooper","Oman",8.2,"Interview start whatever low. Quickly both magazine house interview car meeting. Model win next season.","1994-05-08","2011-03-27"
"evelynwilson","Belize",1.0,"Money away into affect national opportunity. Different majority send without book international. Bit central just guess show.","1970-06-01","2020-02-05"
"evelynwilson","Maldives",4.4,"Various hot agreement point. Now baby include office. Resource behind wear citizen alone might early. None owner school foreign million table condition.","1986-01-02","1994-03-13"
"evelynwilson","Montenegro",9.3,"Current dark machine when bank business affect. Kind pay professor. Foot rate deal back miss house.","2011-09-04","1988-01-10"
"evelynwilson","Andorra",5.9,"Run several dark bill friend we million. Similar message market music power third. Food radio him lose.","1994-10-23","1992-11-26"
"mitchellwendy","Namibia",3.4,"Quite value range. Suggest beyond discover entire they term first environment.","1998-04-29","1981-09-04"
"mitchellwendy","Latvia",3.7,"Standard deal big research wonder meet allow us. Particular only newspaper choose.","1997-12-02","1983-10-23"
"mitchellwendy","Estonia",6.4,"Agreement certain defense expert focus moment cell in. Record we treat case onto.","2020-06-01","2007-10-13"
"mitchellwendy","Eritrea",1.3,"Cover car rock manage nice single present. Focus and form well newspaper.","1987-02-15","2010-12-14"
"mitchellwendy","Romania",5.4,"Democratic final threat call receive medical. Seem front actually both various. Whatever good action bed collection.","2001-05-04","1986-02-28"
"mitchellwendy","Liberia",1.3,"Manage stand smile style sense. Study whole recently degree away court final off.","2008-01-14","1985-08-18"
"mitchellwendy","Chile",8.0,"Off industry brother half pay compare. Less most region mind almost research.","1990-03-19","2009-12-07"
"mitchellwendy","Kiribati",7.0,"Support common group look accept action. Job lay education letter. Approach choose eat especially speak newspaper.","1985-09-17","1970-11-27"
"cindycarrillo","Costa Rica",8.1,"Positive baby view challenge ten.","1975-07-08","2006-07-14"
"cindycarrillo","Cape Verde",0.8,"Indeed again student while hard. Already mission unit share good.","1976-08-26","2014-03-19"
"cindycarrillo","Croatia",0.3,"Economy remember wear. Relationship treat water.","2015-12-17","2002-03-23"
"cindycarrillo","Uganda",3.5,"Add wide wall fight movement Democrat cold. Nation approach certain eat especially section.","2016-03-24","2010-12-11"
"martin44","Latvia",2.9,"There arm meeting enough we blood recently include. Rock condition choice difficult modern mention high really.","1997-10-04","1977-06-12"
"martin44","Ghana",5.6,"Assume method network beautiful something. Both baby product. Deal board whole minute though soon.","1978-08-08","2010-08-10"
"martin44","Azerbaijan",6.6,"Brother among lot last majority. Yourself movie I sure stuff suffer section. Heart blood drop decade.","1988-07-08","1976-04-11"
"martin44","Latvia",5.2,"Order new relationship old move first. Less example country require image right answer. Will score opportunity international yes end right. Use music risk soldier feeling why.","2015-12-11","1976-06-03"
"martin44","Mauritania",4.2,"Take policy power area many. Whether lay first south.","2012-06-18","1978-01-24"
"martin44","Suriname",0.5,"Theory fine whole turn woman mind several. Western from career amount whom change weight. Do whose significant share.","1996-08-01","2017-01-09"
"martin44","Portugal",4.3,"Expect well agree resource foreign his although. Man collection site debate seat of cause.","2012-10-11","1974-04-09"
"martin44","Bolivia",1.8,"Good character loss water professional within floor. Who industry however pattern yet American.","1977-03-19","1998-12-01"
"martin44","Uganda",7.7,"Heart official fall understand reveal. Eight a deep several. Join probably should view authority.","1985-08-13","1972-03-07"
"lisa67","Belize",6.5,"Protect always expert economy the huge. Such project those. Strategy admit particularly responsibility thought.","2000-08-17","1974-05-21"
"lisa67","Dominica",7.3,"Mother perform compare quickly information leg cost. When rich else large laugh they bill. Position level according perform defense yourself job.","1984-07-08","2018-11-18"
"lisa67","Uzbekistan",0.1,"Heavy high half policy present fire front. Hair of go.","1989-11-16","2007-03-31"
"lisa67","Mauritania",9.7,"Think hand gas follow agency sit. Tv fight chair.","2002-11-25","1979-11-07"
"lisa67","Israel",2.2,"Cultural speak finish exactly item civil audience. Because maybe surface imagine. Sing serious customer cut. Hotel left stay job begin defense ground.","1998-12-31","2005-03-08"
"craiggonzales","Angola",3.5,"Cost question performance upon all pattern. Respond crime at machine indeed leader teach want. Relate of green investment police.","2001-08-06","1992-11-06"
"craiggonzales","Malawi",1.0,"Agent important staff meeting cup turn training particular. President challenge order prove. Enter nor news same own street.","2002-04-17","1998-05-13"
"craiggonzales","Tunisia",5.0,"Conference deep until exist traditional they back computer. Reduce tree exactly art according so real.","2003-11-18","1988-02-22"
"craiggonzales","Cambodia",7.3,"Perhaps daughter threat none discuss choice dog. Arrive whose hour think claim difficult need.","2015-08-06","2008-04-21"
"craiggonzales","Australia",9.7,"Former mouth election per executive. Improve avoid live Mrs sit.","2003-08-01","1990-01-09"
"craiggonzales","South Korea",2.5,"Best argue since after may force. Environmental why behavior court including hear expert street. Place more in woman information sing past.","2003-10-18","2013-06-29"
"craiggonzales","Bosnia and Herzegovina",2.0,"Second responsibility my wind. Soon popular only in high property.","2013-03-16","1987-02-01"
"craiggonzales","East Timor",3.4,"Stage many head purpose. Time book sometimes source while oil because those.","1993-03-13","1990-12-27"
"tara67","Nicaragua",1.2,"Matter how consider including relate debate read article. Second half deal interesting theory. Do within yet enjoy stay gun media artist.","1994-07-27","1971-02-16"
"tara67","Equatorial Guinea",0.9,"Television customer feel. Then kind sign report toward whom enough partner.","2019-02-14","1981-11-01"
"tara67","Philippines",1.7,"Exist center significant air model national outside. Painting top memory someone knowledge work store. One million late simply fear activity prepare.","1997-12-09","1991-12-25"
"tara67","Azerbaijan",3.5,"Wrong result work water Democrat kid. Prove hotel account.","1988-12-10","1971-02-27"
"tara67","Somalia",2.1,"Let analysis price prevent. Surface time American thus game next.","1980-08-17","2003-08-13"
"andrea17","Bhutan",9.9,"Help beyond report air. Leave foreign lead deal our serve. Protect culture television every. System quickly nearly include light history.","1992-09-24","1993-10-11"
"andrea17","Vatican City",6.6,"Economic see I over truth show mean. Coach young meet cut thus should.","2011-06-24","1980-07-11"
"andrea17","Romania",0.9,"Professional fight true before never.","2017-08-03","2007-12-19"
"andrea17","Haiti",3.7,"Whether leg plant Mrs. History let rather manage not respond then.","2021-03-31","2018-02-15"
"andrea17","Hungary",5.0,"Let per attorney sense class audience beautiful.","2009-03-23","2002-12-31"
"randy01","Trinidad and Tobago",4.4,"Security factor tell yes stock. Tonight beyond laugh step population list.","2017-10-21","1998-10-02"
"randy01","Hungary",6.2,"Save learn ball style many drug.","2001-03-19","1999-08-21"
"randy01","Kenya",2.2,"Participant young national which top final music cold. Who information left truth several shake. Direction movement particularly statement various year development. History under thus before.","1981-12-18","1988-06-08"
"randy01","Poland",3.0,"Put require song. Will option president relate evidence.","2003-12-03","2019-05-06"
"randy01","Italy",4.0,"Product break expect unit me listen strategy. Population western recent sense.","2021-06-04","2002-10-17"